Ticker,Company,Sector,Industry,Brief_Overview,Detailed_Profile
AES,The AES Corporation,Utilities,Independent Power Producers & Energy Traders,ผู้นำด้านพลังงานสะอาดระดับโลก — ผู้ให้บริการพลังงานหมุนเวียนรายใหญ่ที่สุดสำหรับลูกค้าองค์กร ดำเนินธุรกิจในหลายประเทศ มี backlog พลังงานหมุนเวียนในสหรัฐฯ 7.5 GW ที่ safe harbored แล้ว EBITDA guidance ปี 2025 ที่ $2.65-$2.85B คาดเติบโต 5-7% CAGR กำลังรุกตลาด data center ผ่าน Development Transfer Agreements,AES ก่อตั้งปี 1981 มีสำนักงานใหญ่ที่ Arlington รัฐ Virginia ดำเนินธุรกิจผลิตและจำหน่ายไฟฟ้าในหลายทวีป CEO Andrés Gluski นำทีมเปลี่ยนผ่านจากบริษัทพลังงานแบบดั้งเดิมสู่ผู้นำด้านพลังงานสะอาด ธุรกิจครอบคลุมทั้ง Renewables (พลังงานลม/แสงอาทิตย์/แบตเตอรี่); Utilities (AES Indiana และ AES Ohio); และ Energy Infrastructure ผลประกอบการ Q3 2025 adjusted EBITDA $830M เพิ่มจาก $698M ปีก่อน EBITDA จาก renewables เพิ่มขึ้น 46% YTD ปี 2025 อยู่ระหว่างก่อสร้างโครงการ 3.2 GW โดย 2.9 GW แล้วเสร็จ กลยุทธ์สำคัญคือการเป็นผู้นำด้านพลังงานสะอาดสำหรับ data center โดยมี 4.2 GW ที่ส่งมอบแล้วและอีก 4 GW ใน backlog; การ safe harbor tax credit สำหรับโครงการ 7.5 GW; แผนลดต้นทุน $300M ต่อปีภายในปี 2026; และการขายสินทรัพย์ที่ไม่จำเป็น (เช่น AES Brazil) จุดแข็งคือ pipeline พลังงานหมุนเวียนที่ใหญ่มาก; supply chain ในประเทศที่ไม่มี FIAC exposure; ตำแหน่ง tax credit ที่แข็งแกร่ง; และความสัมพันธ์กับลูกค้า data center รายใหญ่ ความเสี่ยงหลักได้แก่ นโยบายพลังงานที่อาจเปลี่ยนแปลง; ความผันผวนของราคาพลังงาน; หนี้สินจำนวนมาก; และความเสี่ยงจากการดำเนินงานในหลายประเทศรวมถึงตลาดเกิดใหม่
AFL,Aflac Incorporated,Financials,Life & Health Insurance,แบรนด์ประกันเสริมที่คนจำได้ทั่วโลก — ผู้นำตลาดประกันมะเร็งและประกันเสริมสุขภาพในญี่ปุ่นและสหรัฐฯ Q3 2025 รายได้ $4.74B กำไรสุทธิ $1.6B EPS $2.49 ทำ surprise 40% เหนือ consensus Adjusted ROE สูงถึง 19-22% บริษัทคืนเงินให้ผู้ถือหุ้น $1.3B ในไตรมาสเดียว ผ่านการซื้อหุ้นคืนและปันผล,Aflac ก่อตั้งปี 1955 โดยพี่น้องตระกูล Amos ในรัฐ Georgia ปัจจุบัน CEO Daniel P. Amos บริหารมายาวนานเป็นหนึ่งใน CEO ที่อยู่นานที่สุดใน S&P 500 ธุรกิจแบ่งเป็น 2 segment: Aflac Japan ซึ่งสร้างรายได้ส่วนใหญ่ เน้นประกันมะเร็งและประกัน third sector; และ Aflac US เน้นประกันเสริมสุขภาพผ่าน worksite ผลประกอบการ Q3 2025 รายได้รวม $4.74B เพิ่มจาก $2.9B ปีก่อน (ส่วนหนึ่งจาก investment gains) adjusted EPS เพิ่ม 15.3% YoY คืนเงินผู้ถือหุ้นรวม $1.3B โดยซื้อหุ้นคืน $1.0B (9.3 ล้านหุ้น) และจ่ายปันผล $309M สภาพคล่องของ holding company อยู่ที่ $4.5B ซึ่งสูงกว่าขั้นต่ำ $2.7B กลยุทธ์สำคัญรวมถึงการเปิดตัวผลิตภัณฑ์ Tsumitasu ในญี่ปุ่นสำหรับกลุ่มลูกค้าอายุน้อย; การ bundle ผลิตภัณฑ์ life/absence/disability ใน US; การใช้เทคโนโลยี digital เพื่อเข้าถึงลูกค้านอก worksite; และการบริหารเงินทุนอย่างมีวินัย จุดแข็งคือ brand awareness ที่สูงมาก; ตำแหน่งผู้นำในตลาดประกันเสริมญี่ปุ่น; adjusted book value ที่แข็งแกร่ง $53.33/หุ้น; และ capital return policy ที่ดีเยี่ยม ความเสี่ยงหลักได้แก่ เบี้ยประกันใน Aflac Japan ที่ลดลง 4% จากการ reinsurance ภายใน; ความเสี่ยงด้านอัตราแลกเปลี่ยนเยน/ดอลลาร์; CECL reserves สำหรับอสังหาริมทรัพย์เชิงพาณิชย์ที่เพิ่มขึ้น; และเหตุการณ์ unauthorized access เข้าเครือข่ายในมิ.ย. 2025
AIG,American International Group Inc.,Financials,Multi-line Insurance,ยักษ์ประกันภัยที่กลับมาแข็งแกร่ง — หนึ่งในบริษัทประกันภัยที่ใหญ่ที่สุดในโลก ให้บริการประกันวินาศภัยเชิงพาณิชย์และส่วนบุคคล รายได้ปี 2025 ราว $26.8B Market cap ราว $50B ผ่านการ turnaround สำเร็จหลังวิกฤตการเงิน 2008 ล่าสุดเข้าซื้อหุ้นส่วนน้อยใน Convex Group และ Onex เพื่อขยายธุรกิจ specialty insurance,AIG ก่อตั้งปี 1919 โดย Cornelius Vander Starr ในเซี่ยงไฮ้ ปัจจุบันเป็นบริษัทประกันระดับโลกที่ผ่านการปฏิรูปครั้งใหญ่หลังวิกฤตการเงิน CEO Peter Zaffino นำทีม turnaround สำเร็จ ธุรกิจหลักแบ่งเป็น General Insurance (ประกันวินาศภัยเชิงพาณิชย์/อุตสาหกรรม ประกันภัยส่วนบุคคล และ specialty lines); และ Other Operations ที่รวมถึงการลงทุนและธุรกิจที่อยู่ระหว่าง run-off หลังจากแยก Corebridge Financial (ธุรกิจ life & retirement) ออกไป AIG เน้นเป็น pure-play property-casualty insurer ผลประกอบการปี 2025 รายได้รวมราว $26.8B ลดลง 1.75% YoY ไตรมาส 4 มีรายได้ $6.55B ลดลง 8.7% YoY โดยรายได้จากการลงทุนสุทธิลดลง อย่างไรก็ตาม underwriting improvement เป็นที่ยั่งยืน กลยุทธ์สำคัญรวมถึงการเข้าซื้อหุ้นส่วนน้อยใน Convex Group (specialty insurer) และ Onex Corporation; การมุ่งเน้น underwriting discipline และการบริหารความเสี่ยงอย่างเข้มงวด; การปรับ portfolio ให้เน้น specialty lines มากขึ้น; และการคืนเงินให้ผู้ถือหุ้นผ่านการซื้อหุ้นคืน จุดแข็งคือ global distribution network ที่ครอบคลุม; ความเชี่ยวชาญด้าน commercial lines; underwriting ที่ดีขึ้นอย่างต่อเนื่อง; และ brand ที่แข็งแกร่งในตลาดประกันภัยเชิงพาณิชย์ ความเสี่ยงหลักได้แก่ catastrophe risk จากภัยธรรมชาติที่รุนแรงขึ้น; social inflation ที่ทำให้ค่าสินไหมเพิ่มขึ้น; การแข่งขันในตลาด commercial insurance; และรายได้จากการลงทุนที่อาจลดลงในสภาพแวดล้อมดอกเบี้ยขาลง
AIZ,Assurant Inc.,Financials,Multi-line Insurance,ผู้เชี่ยวชาญด้าน lifestyle protection — ให้บริการประกันและโปรแกรมคุ้มครองสำหรับอุปกรณ์มือถือ ที่อยู่อาศัย รถยนต์ และสินค้าอิเล็กทรอนิกส์ ร่วมมือกับ brand ชั้นนำทั่วโลก อาทิ T-Mobile และ Samsung รายได้ราว $11B ต่อปี Market cap ราว $10B ธุรกิจ Connected Living เป็น growth driver หลัก,Assurant ก่อตั้งปี 2004 (แยกจาก Fortis) สำนักงานใหญ่ที่ New York CEO Keith Demmings นำทีมเปลี่ยนผ่านจากบริษัทประกันแบบดั้งเดิมสู่ผู้ให้บริการ lifestyle protection ที่เน้นเทคโนโลยี ธุรกิจแบ่งเป็น 2 segment หลัก: Global Lifestyle ซึ่งครอบคลุมการคุ้มครองอุปกรณ์มือถือ (device protection) การคุ้มครองรถยนต์ (auto) และประกัน credit insurance คิดเป็นสัดส่วนรายได้ส่วนใหญ่; และ Global Housing ที่ครอบคลุมประกัน lender-placed homeowners และ renters insurance ผลประกอบการปี 2025 รายได้รวมราว $11B โดย Connected Living เป็น segment ที่เติบโตเร็วที่สุดจากความต้องการคุ้มครองอุปกรณ์สมาร์ทโฟนและ IoT devices ที่เพิ่มขึ้น กลยุทธ์สำคัญคือการขยาย partnership กับ OEM และ carrier รายใหญ่; การเพิ่มบริการซ่อมและเปลี่ยนอุปกรณ์แบบครบวงจร; การใช้ analytics และ AI ในการบริหาร claims; และการขยายตลาดต่างประเทศ จุดแข็งคือ partnership กับแบรนด์ชั้นนำ; ความเชี่ยวชาญด้าน embedded insurance; scale ที่ใหญ่ในตลาด device protection; และ recurring revenue จากโปรแกรมคุ้มครองรายเดือน ความเสี่ยงหลักได้แก่ การพึ่งพาลูกค้ารายใหญ่ไม่กี่ราย; วงจร smartphone ที่ยืดออก; ความเสี่ยงจากภัยธรรมชาติใน Housing segment; และการแข่งขันจาก insuretech startups
AJG,Arthur J. Gallagher & Co.,Financials,Insurance Brokers,นายหน้าประกันภัยอันดับ 3 ของโลก — ให้บริการนายหน้าประกันภัยและบริหารความเสี่ยงใน 130 ประเทศ รายได้ปี 2025 ทะลุ $13.9B เติบโต 21% YoY หลังเข้าซื้อ AssuredPartners มูลค่า $13.8B Market cap ราว $90B สร้าง double-digit revenue growth ติดต่อกัน 20 ไตรมาส CEO Pat Gallagher บริหารมาตั้งแต่ปี 1995,Arthur J. Gallagher ก่อตั้งปี 1927 ที่ Chicago โดย Arthur James Gallagher CEO ปัจจุบัน J. Patrick Gallagher Jr. เป็นหนึ่งใน CEO ที่อยู่นานที่สุดใน S&P 500 บริหารมาตั้งแต่ปี 1995 ธุรกิจแบ่งเป็น 2 segment: Brokerage (นายหน้าประกันภัยทั้ง retail/wholesale/reinsurance คิดเป็นสัดส่วนรายได้หลัก) และ Risk Management ผ่าน Gallagher Bassett ที่ให้บริการจัดการ claims ผลประกอบการปี 2025 รายได้รวมราว $13.9B เติบโต 21% YoY ขับเคลื่อนโดยการเข้าซื้อ AssuredPartners มูลค่า $13.8B ปิด deal ในส.ค. 2025 ซึ่งเป็น deal ใหญ่ที่สุดในประวัติศาสตร์บริษัท Organic growth ยังแข็งแกร่งที่ 6-7% adjusted EBITDAC margin ราว 32% M&A pipeline มีอีกกว่า 40 term sheets ใน pipeline มูลค่ารวม $350M ของ annualized revenue กลยุทธ์สำคัญคือ two-pronged growth strategy (organic + M&A); การผสาน AssuredPartners เข้ากับระบบ โดยคาดว่าจะได้ synergy $160M ในปี 2026; การใช้ AI ผ่าน Digital Sherpas; และการขยายธุรกิจ cyber insurance consulting จุดแข็งคือ วัฒนธรรมองค์กรที่แข็งแกร่ง; M&A track record ที่ยอดเยี่ยม (50-75 acquisitions ต่อปี); global distribution ใน 130 ประเทศ; และ data analytics ที่เหนือกว่า ความเสี่ยงหลักได้แก่ integration risk จาก AssuredPartners ที่เป็น deal ขนาดใหญ่; หนี้ที่เพิ่มขึ้นจากการกู้ $5B; valuation ที่สูง; และ AI disruption ที่อาจกระทบ traditional brokerage model
AKAM,Akamai Technologies Inc.,Information Technology,Internet Services & Infrastructure,ผู้นำด้าน CDN และ Cloud Security — ให้บริการ content delivery network ที่ใหญ่ที่สุดในโลก พร้อม security solutions ที่เติบโตเร็ว รายได้ราว $4B ต่อปี เติบโต 4-5% YoY Security solutions กลายเป็น segment ใหญ่ที่สุดแซง delivery แล้ว กำลังรุกตลาด cloud computing ผ่าน Linode ที่เข้าซื้อในปี 2022,Akamai ก่อตั้งปี 1998 โดย Tom Leighton และ Danny Lewin จาก MIT CEO Tom Leighton บริหารมาตั้งแต่ปี 2013 ธุรกิจเปลี่ยนผ่านจาก CDN pure-play สู่ 3 เสาหลัก: Security Technology ซึ่งเป็น segment ที่ใหญ่ที่สุดและเติบโตเร็วที่สุดราว 15% YoY ครอบคลุม web application firewall / DDoS protection / zero trust / API security; Delivery Technology (CDN แบบดั้งเดิม) ที่รายได้ลดลงทุกปีเนื่องจากราคาต่อ unit ลดลง; และ Compute Technology (cloud computing ผ่าน Linode) ที่เติบโตราว 25% YoY ผลประกอบการปี 2025 รายได้รวมราว $4B กำไร non-GAAP operating margin ราว 30% กลยุทธ์สำคัญคือการขยาย Security segment ให้ครอบคลุม API security/microsegmentation มากขึ้น; การสร้าง distributed cloud platform ผ่าน Linode ที่มี edge locations ทั่วโลก; การใช้ AI เพื่อตรวจจับภัยคุกคาม; และการ cross-sell security ให้ลูกค้า CDN เดิม จุดแข็งคือเครือข่าย edge ที่กระจายตัวมากที่สุดในโลก (กว่า 4000 locations); ความเชี่ยวชาญด้าน web security; ฐานลูกค้าองค์กรขนาดใหญ่; และ recurring revenue สูง ความเสี่ยงหลักได้แก่ CDN revenue ที่ลดลงอย่างต่อเนื่อง; การแข่งขันจาก Cloudflare/Fastly ด้าน security และ AWS/Azure/GCP ด้าน cloud; ความท้าทายในการ scale Linode ให้แข่งกับ hyperscalers; และ margin pressure จากการลงทุนใน compute
ALB,Albemarle Corporation,Materials,Specialty Chemicals,ราชาแห่งลิเธียม — ผู้ผลิตลิเธียมรายใหญ่ที่สุดในโลก ซึ่งเป็นวัตถุดิบสำคัญสำหรับแบตเตอรี่ EV และ energy storage รายได้ปี 2024 ราว $5.4B แต่ลดลงอย่างมากจากราคาลิเธียมที่ดิ่งลง Market cap ราว $8-10B กำลังปรับโครงสร้างลดต้นทุนรับมือกับวงจรขาลง รอการฟื้นตัวของราคาลิเธียมจาก EV adoption,Albemarle ก่อตั้งปี 1994 (แยกจาก Ethyl Corporation) สำนักงานใหญ่ที่ Charlotte รัฐ North Carolina CEO Kent Masters นำทีมรับมือกับวงจรขาลงของราคาลิเธียมอย่างหนัก ธุรกิจแบ่งเป็น 3 segment: Energy Storage (ลิเธียมสำหรับแบตเตอรี่ EV เป็น segment ใหญ่สุดราว 60-70% ของรายได้); Specialties (bromine compounds สำหรับ flame retardants); และ Ketjen (catalysts สำหรับ refining) ผลประกอบการล่าสุดได้รับผลกระทบอย่างหนักจากราคาลิเธียมที่ลดลงกว่า 70% จากจุดสูงสุดในปี 2022 รายได้ปี 2024 อยู่ที่ราว $5.4B ลดลงจาก $9.6B ในปี 2023 และคาดว่าปี 2025 จะลดลงอีก กลยุทธ์รวมถึงการปรับลดต้นทุนและ capex อย่างรุนแรง; การเลื่อนโครงการขยายกำลังผลิตที่ไม่จำเป็น; การรักษา investment-grade credit rating; และการเตรียมพร้อมสำหรับวงจรขาขึ้นรอบถัดไปจาก EV adoption ที่ยังเติบโต จุดแข็งคือเป็นผู้ผลิตลิเธียมที่ต้นทุนต่ำที่สุดรายหนึ่ง; แหล่งผลิตที่หลากหลาย (Chile/Australia/US/China); ความสัมพันธ์กับ EV OEM รายใหญ่; และ bromine business ที่ stable ความเสี่ยงหลักได้แก่ ราคาลิเธียมที่ยังไม่ฟื้นตัว; oversupply จากการขยายกำลังผลิตทั่วโลก; ความเสี่ยงด้านกฎระเบียบเหมืองแร่ใน Chile; และการแข่งขันจากผู้ผลิตจีนที่ขยายตัวอย่างรวดเร็ว
ALGN,Align Technology Inc.,Health Care,Health Care Supplies,ผู้คิดค้น Invisalign จัดฟันใส — ผู้นำตลาด clear aligner ระดับโลกที่รักษาผู้ป่วยแล้วกว่า 22.1 ล้านราย Q4 2025 รายได้สูงสุดเป็นประวัติการณ์ $1.05B เติบโต 5.3% YoY มี doctors ที่ผ่านการอบรมราว 295600 คนทั่วโลก กำลังพัฒนา 3D-printed retainers และ AI-driven treatment planning,Align Technology ก่อตั้งปี 1997 สำนักงานใหญ่ที่ Tempe รัฐ Arizona CEO Joe Hogan นำทีมขยายตลาด clear aligner จาก niche สู่ mainstream ธุรกิจแบ่งเป็น 2 segment: Clear Aligner (Invisalign) คิดเป็นราว 80% ของรายได้; และ Systems & Services (iTero scanners / exocad CAD/CAM software) ผลประกอบการ Q4 2025 รายได้รวม $1.05B เป็นสถิติสูงสุด เติบโต 5.3% YoY ปริมาณ clear aligner 677000 cases เพิ่ม 7.7% YoY EPS $3.29 เหนือ consensus Scanner revenue $209.4M เพิ่ม 4.2% YoY ปีเต็ม 2025 ปริมาณ 2.6 ล้าน cases เพิ่ม 4.7% YoY โดย teens & kids 936000 cases เพิ่ม 7.8% Guidance ปี 2026 คาดรายได้เติบโต 3-4% YoY กลยุทธ์สำคัญคือการพัฒนา 3D-printed retainers และ attachments ที่จะเริ่ม limited release ในปี 2026; ClinCheck Live Plan ที่ใช้ AI สร้าง treatment plan ภายใน 15 นาที; การขยาย DSO channel ที่เติบโต double-digit; และการรุกตลาด teens & kids จุดแข็งคือ brand ที่แข็งแกร่งเป็น #1 doctor trusted clear aligner; ฐานข้อมูล treatment 22.1 ล้าน cases; iTero scanner ecosystem; และ switching cost สำหรับ doctors ความเสี่ยงหลักได้แก่ การแข่งขันจาก SmileDirectClub competitors และ generic aligners; China VBP policy; ASP ที่คาดว่าจะลดลง 1-2% ในปี 2026; และผลกระทบจาก tariff/อัตราแลกเปลี่ยน
