Ticker,Company,Sector,Industry,Brief_Overview,Detailed_Profile
ARE,Alexandria Real Estate Equities Inc.,Real Estate,Office REITs,ผู้นำ life science real estate — Alexandria เป็น REIT ชั้นนำที่เน้น life science/agri-tech/technology campus เป็นเจ้าของพื้นที่ให้เช่ากว่า 42 ล้าน sq ft ในหับ innovation สำคัญอย่าง Boston/San Francisco/San Diego ผู้เช่าหลักเป็นบริษัท biopharma และ tech ระดับโลก revenue ราว $3B ต่อปี เผชิญความท้าทายจากอุปทานล้นในบาง sub-market,Alexandria Real Estate Equities ก่อตั้งปี 1994 โดย Joel Marcus สำนักงานใหญ่ Pasadena California นำโดย CEO Joel Marcus (co-CEO กับ Peter Moglia) เป็น REIT ผู้บุกเบิกและครองตลาด life science real estate ถือครอง/develop พื้นที่กว่า 42 ล้าน sq ft ใน innovation cluster ชั้นนำของสหรัฐ ได้แก่ Greater Boston/San Francisco Bay Area/San Diego/Seattle/Research Triangle ผู้เช่าระดับ investment-grade กว่า 50% รวมถึง Moderna/Bristol Myers Squibb/Eli Lilly ธุรกิจสร้างรายได้จาก long-term leases ระยะเฉลี่ย 7-10 ปี พร้อม annual rent escalation กลยุทธ์สำคัญคือ mega campus model ที่สร้าง ecosystem สำหรับ tenant ตั้งแต่ startup ถึง big pharma พร้อม development pipeline กว่า 5 ล้าน sq ft จุดแข็งคือ first-mover advantage ใน life science REIT มี barrier to entry สูงเพราะ lab space ต้อง specialized build-out และ tenant base ที่แข็งแกร่ง ความเสี่ยงหลักได้แก่ อุปทานล้นใน sub-market บางแห่ง อัตราดอกเบี้ยสูงกดดัน valuation ของ REIT การชะลอตัวของ biotech funding และ remote work trend ที่อาจลด demand สำหรับ office/lab hybrid space
ARES,Ares Management Corporation,Financials,Asset Management & Custody Banks,ดาวรุ่งแห่ง alternative investment — Ares Management เป็นผู้จัดการสินทรัพย์ทางเลือกที่เติบโตเร็วที่สุดรายหนึ่ง AUM ราว $484B เชี่ยวชาญด้าน credit/private equity/real estate/infrastructure นำโดย CEO Michael Arougheti ได้รับประโยชน์จาก secular shift สู่ private credit ที่ขยายตัวต่อเนื่อง,Ares Management ก่อตั้งปี 1997 สำนักงานใหญ่ Los Angeles California นำโดย CEO Michael Arougheti เป็นหนึ่งในผู้จัดการสินทรัพย์ทางเลือกที่เติบโตเร็วที่สุด ธุรกิจแบ่ง 4 กลุ่มหลัก: Credit Group (กลุ่มใหญ่สุด ครอบคลุม direct lending/liquid credit/alternative credit) Private Equity Group Real Estate Group และ Infrastructure Group AUM เพิ่มขึ้นอย่างรวดเร็วจากราว $150B ในปี 2020 สู่ราว $484B Fee-related earnings เติบโตต่อเนื่องจาก management fees ที่เพิ่มขึ้นตาม AUM กลยุทธ์สำคัญคือการขยาย direct lending platform ที่ได้ประโยชน์จากการถอยของธนาคาร traditional ออกจาก mid-market lending พร้อมขยาย insurance channel ผ่าน Aspida platform และ infrastructure investments ใน energy transition/digital infrastructure จุดแข็งคือ credit-first DNA ที่เหมาะกับ current market environment diversified platform ข้ามสินทรัพย์ และ strong fundraising momentum ความเสี่ยงหลักได้แก่ credit cycle risk หาก default rates เพิ่มขึ้น fee compression จากการแข่งขันที่รุนแรง regulatory scrutiny ใน private credit และ valuation ที่สูงเมื่อเทียบกับ historical average
ATO,Atmos Energy Corporation,Utilities,Gas Utilities,ผู้นำด้านจัดจำหน่ายก๊าซธรรมชาติ — Atmos Energy เป็นบริษัทจัดจำหน่าย natural gas รายใหญ่ที่สุดในสหรัฐ ให้บริการลูกค้ากว่า 3 ล้านราย ใน 8 รัฐ มี regulated utility model ที่สร้าง earnings ที่มั่นคง EPS เติบโตเฉลี่ย 6-8% ต่อปี พร้อม capital investment program ขนาดใหญ่เพื่ออัพเกรด pipeline infrastructure,Atmos Energy ก่อตั้งปี 1906 สำนักงานใหญ่ Dallas Texas เป็นบริษัท natural gas distribution รายใหญ่ที่สุดในสหรัฐ ธุรกิจแบ่ง 2 segment: Distribution (จัดส่ง natural gas ให้ลูกค้า residential/commercial/industrial กว่า 3 ล้านราย ใน 8 รัฐ) และ Pipeline and Storage (ดำเนินงาน intrastate pipeline ใน Texas) รายได้ส่วนใหญ่มาจาก regulated operations ที่มี rate recovery mechanism สร้างรายได้ที่คาดการณ์ได้ กลยุทธ์สำคัญคือ capital investment program ขนาดใหญ่ราว $3-3.5B ต่อปี เพื่อเปลี่ยน aging pipeline ด้วยระบบใหม่ที่ปลอดภัยและมีประสิทธิภาพกว่า ซึ่งจะเพิ่ม rate base และผลักดัน earnings growth การลงทุนนี้ได้รับ regulatory support เพราะเป็นเรื่อง safety จุดแข็งคือ pure-play regulated gas utility ที่มีความเสี่ยงต่ำ earnings visibility สูง และ dividend ที่เติบโตสม่ำเสมอ (Dividend Aristocrat) ความเสี่ยงหลักได้แก่ อัตราดอกเบี้ยสูงที่เพิ่มต้นทุน capital regulatory risk จากการเปลี่ยนแปลงนโยบาย energy transition ที่อาจลด demand สำหรับ natural gas ในระยะยาว และสภาพอากาศที่ผันผวน
AVB,AvalonBay Communities Inc.,Real Estate,Residential REITs,"ผู้นำ apartment REIT ชั้นนำ — AvalonBay เป็นหนึ่งใน REIT ที่พัฒนาและบริหารอพาร์ทเมนท์คุณภาพสูงรายใหญ่ที่สุดในสหรัฐ ถือครองกว่า 300 communities ราว 92,000 units ใน metro area ชั้นนำ เช่น New York/Boston/DC/California/Seattle มุ่งเน้นตลาด high-barrier-to-entry ที่มีอุปทานจำกัด","AvalonBay Communities ก่อตั้งปี 1978 สำนักงานใหญ่ Arlington Virginia เป็น S&P 500 REIT ชั้นนำด้าน multifamily housing ถือครอง/develop/บริหารอพาร์ทเมนท์กว่า 300 communities ราว 92,000 units ใน high-demand markets ได้แก่ New England/Metro New York-New Jersey/Mid-Atlantic/Pacific Northwest/Northern-Southern California ธุรกิจสร้างรายได้จาก rental income ของ apartment communities ที่ตั้งอยู่ในพื้นที่ที่มี supply constraint กลยุทธ์สำคัญคือการเน้น high-barrier-to-entry markets ที่มี job/population growth สูง พร้อม development pipeline ที่สร้าง units ใหม่เพื่อเพิ่ม NOI รวมถึงการลงทุนใน proptech และ operational efficiency ผ่าน technology platform จุดแข็งคือ portfolio ที่กระจุกตัวใน high-demand markets มี pricing power จาก limited supply balance sheet แข็งแกร่งระดับ investment-grade และ development capabilities ที่สร้าง value creation ความเสี่ยงหลักได้แก่ อัตราดอกเบี้ยสูงที่กดดัน REIT valuation rent control/regulation ที่อาจจำกัด pricing power new supply ที่กำลังเข้าสู่บางตลาด และ affordability concerns ที่อาจลด demand"
AVGO,Broadcom Inc.,Information Technology,Semiconductors,อาณาจักรชิปและซอฟต์แวร์แห่ง AI — Broadcom เป็นยักษ์ใหญ่ด้าน semiconductor + infrastructure software รายได้ปีงบ 2025 ทำสถิติ $64B (+24% YoY) AI revenue โตก้าวกระโดด 65% เป็น $20B พร้อม VMware software revenue $27B AI backlog เกิน $73B market cap กว่า $1 trillion เป็นคู่แข่ง custom AI chip หลักของ NVIDIA,Broadcom ก่อตั้งจากการรวม Avago Technologies กับ Broadcom Corporation ปี 2016 นำโดย CEO Hock Tan ผู้มีชื่อเสียงด้าน M&A strategy สำนักงานใหญ่ Palo Alto California ธุรกิจแบ่ง 2 segment ใหญ่: Semiconductor Solutions ($37B - 58% ของรายได้) และ Infrastructure Software ($27B - 42% จาก VMware/Symantec/CA) ปีงบ 2025 (สิ้นสุด พ.ย.) รายได้สถิติ $64B (+24% YoY) Q4 รายได้ $18B (+28% YoY) non-GAAP operating margin 66.2% free cash flow $26.9B (+39% YoY) AI semiconductor revenue $20B ใน FY25 (+65% YoY) โดย custom AI accelerators (XPUs) เป็น growth driver หลัก ลูกค้าคือ hyperscalers รายใหญ่ รวมถึง Google/Meta/ByteDance AI backlog เกิน $73B จะส่งมอบใน 18 เดือน กลยุทธ์คือ custom AI chip + networking (Tomahawk 6 switch 102Tbps) + VMware Cloud Foundation subscription model Guidance Q1 FY26 คาดรายได้ $19.1B AI semiconductor revenue $8.2B (+100% YoY) จุดแข็งคือ portfolio ที่ครอบคลุมทั้ง chip + software สร้าง recurring revenue มี EBITDA margin 67% ที่สูงมาก และ custom AI chip pipeline ที่แข็งแกร่ง ความเสี่ยงหลักได้แก่ concentration risk จาก hyperscaler ไม่กี่ราย gross margin ลดลงจาก AI mix ที่เพิ่มขึ้น non-AI semiconductor ที่แทบไม่โต competition จาก Marvell/custom designs และ global minimum tax ที่จะเพิ่ม tax rate เป็น 16.5%
AVY,Avery Dennison Corporation,Materials,Specialty Chemicals,ผู้นำ labeling และ packaging materials — Avery Dennison เป็นผู้ผลิต pressure-sensitive materials/labeling solutions และ RFID technology ชั้นนำของโลก รายได้ราว $8.5B ธุรกิจ Materials Group เป็นเสาหลัก พร้อม Intelligent Labels (RFID) เป็น high-growth segment ที่ขยายตัวเข้าสู่ retail/logistics/healthcare,Avery Dennison ก่อตั้งปี 1935 สำนักงานใหญ่ Mentor Ohio นำโดย CEO Deon Stander เป็นผู้นำระดับโลกด้าน pressure-sensitive labeling materials และ functional/RFID solutions ธุรกิจแบ่ง 2 segment: Materials Group (ผลิต pressure-sensitive label/graphic materials คิดเป็นราว 65% ของรายได้ เป็น cash cow) และ Solutions Group (Intelligent Labels/RFID tags/apparel solutions ราว 35% เป็น growth engine) รายได้รวมราว $8.5B เติบโตจาก Intelligent Labels ที่ขยายตัวอย่างรวดเร็วจาก RFID adoption ใน retail apparel สู่ food/logistics/healthcare กลยุทธ์สำคัญคือ Intelligent Labels platform ที่ใช้ RFID technology เชื่อมโยง physical products กับ digital world ช่วย retailer ทำ inventory management ลด shrinkage และเพิ่ม efficiency รวมถึง sustainability initiatives ด้าน recyclable labeling จุดแข็งคือ market leadership ใน pressure-sensitive materials ที่มี economies of scale สูง RFID technology ที่มี first-mover advantage และ global distribution network ความเสี่ยงหลักได้แก่ ต้นทุนวัตถุดิบที่ผันผวน การชะลอตัวของ consumer spending ที่กระทบ retail demand RFID adoption ที่อาจช้ากว่าคาด และ competition จากผู้ผลิต label รายอื่น
AWK,American Water Works Company Inc.,Utilities,Water Utilities,ผู้นำด้านน้ำประปาของสหรัฐ — American Water Works เป็นบริษัทสาธารณูปโภคด้านน้ำและน้ำเสียที่ใหญ่ที่สุดในสหรัฐ ให้บริการลูกค้ากว่า 14 ล้านคน ใน 14 รัฐ regulated water utility สร้าง earnings ที่มั่นคง พร้อม capital investment program สำหรับ infrastructure upgrade ที่ผลักดัน rate base growth,American Water Works ก่อตั้งปี 1886 สำนักงานใหญ่ Camden New Jersey เป็นบริษัท regulated water/wastewater utility ที่ใหญ่ที่สุดในสหรัฐ ให้บริการลูกค้ากว่า 14 ล้านคน ใน 14 รัฐ ผ่าน subsidiaries หลายราย ธุรกิจหลักคือ Regulated Businesses (คิดเป็นกว่า 90% ของรายได้) ที่จัดหา/บำบัด/จ่ายน้ำประปา และรวบรวม/บำบัดน้ำเสีย ภายใต้การกำกับดูแลของ state regulatory commissions กลยุทธ์สำคัญคือ capital investment ขนาดใหญ่ราว $3.5-4B ต่อปี เพื่อเปลี่ยน aging water infrastructure ที่เก่าแก่หลายทศวรรษ ซึ่งจะเพิ่ม rate base และผลักดัน EPS growth 7-9% ต่อปี รวมถึง M&A strategy ที่เข้าซื้อ municipal water systems ขนาดเล็ก-กลาง จุดแข็งคือ essential service monopoly ที่มี regulatory protection สร้าง earnings ที่คาดการณ์ได้สูง water scarcity trend ที่เพิ่มมูลค่า water assets และ scale advantage ที่ใหญ่ที่สุดในอุตสาหกรรม ความเสี่ยงหลักได้แก่ regulatory risk จากการอนุมัติ rate increase ที่อาจล่าช้า อัตราดอกเบี้ยสูงที่เพิ่มต้นทุน capital PFAS/lead remediation ที่อาจต้อง capex เพิ่ม และ drought/climate change
AXON,Axon Enterprise Inc.,Industrials,Aerospace & Defense,ผู้พลิกโฉมเทคโนโลยีความปลอดภัยสาธารณะ — Axon (เดิมชื่อ TASER) เป็นผู้นำด้าน public safety technology ตั้งแต่ body cameras/TASER ไปจนถึง cloud software (Axon Evidence) รายได้เติบโตกว่า 30% ต่อปี ขับเคลื่อนโดย recurring SaaS revenue จาก Axon Cloud และ AI-powered solutions สำหรับ law enforcement,Axon Enterprise ก่อตั้งปี 1993 โดย Rick Smith สำนักงานใหญ่ Scottsdale Arizona นำโดย CEO Rick Smith ผู้มีวิสัยทัศน์ในการเปลี่ยน TASER จากผู้ผลิตอาวุธไฟฟ้าสู่ technology platform ครบวงจรสำหรับ public safety ธุรกิจแบ่ง 3 กลุ่ม: TASER (conducted energy devices) Sensor and Other (body cameras/fleet cameras/VR training) และ Axon Cloud and Services (cloud-based digital evidence management/records management) Axon Cloud เป็น growth engine หลัก สร้าง recurring revenue จาก SaaS subscription รายได้เติบโตต่อเนื่องกว่า 30% ต่อปี ขับเคลื่อนโดย annual recurring revenue (ARR) ที่เพิ่มขึ้นจาก cross-selling products ให้ agencies ที่มีอยู่ กลยุทธ์สำคัญคือ Draft One (AI-powered report writing) ที่ช่วยตำรวจเขียนรายงานเร็วขึ้น 8 เท่า และ AI-powered real-time assistance tools พร้อมขยายสู่ตลาดใหม่เช่น enterprise security และ international markets จุดแข็งคือ ecosystem ที่ lock-in ลูกค้า (hardware+cloud+AI) มี switching costs สูง และ mission-critical nature ของ product ความเสี่ยงหลักได้แก่ government budget cycles ที่อาจชะลอ procurement regulatory concerns เกี่ยวกับ AI ใน policing competition จาก Motorola Solutions และ valuation ที่สูงเมื่อเทียบกับ peers
AXP,American Express Company,Financials,Consumer Finance,แบรนด์การเงินพรีเมียมระดับโลก — American Express เป็นบริษัท payments/credit card ที่เน้นกลุ่มลูกค้า premium/affluent รายได้ปี 2025 ราว $66B+ ด้วย closed-loop network ที่เก็บทั้ง issuing fees และ merchant fees กำลังเติบโตจากฐาน millennial/Gen Z cardmembers ที่เพิ่มขึ้นอย่างรวดเร็ว,American Express ก่อตั้งปี 1850 สำนักงานใหญ่ New York City นำโดย CEO Stephen Squeri เป็นหนึ่งในแบรนด์การเงินที่แข็งแกร่งที่สุดในโลก ดำเนินงานผ่าน closed-loop network ที่เป็นทั้ง card issuer และ payment network ธุรกิจแบ่ง 4 segment: U.S. Consumer Services/Commercial Services/International Card Services/Global Merchant and Network Services รายได้หลักมาจาก discount revenue (merchant fees) net interest income และ card fees จุดเด่นคือ spend-centric model ที่เน้น transaction volume มากกว่า revolving balance กลยุทธ์สำคัญคือการขยายฐาน premium cardmembers โดยเฉพาะ millennials/Gen Z ผ่าน membership rewards/lounge access/dining credits พร้อมเสริม digital experience และ buy now pay later offerings จุดแข็งคือ brand premium ที่ดึงดูด high-spending customers ด้วย average spend per card สูงกว่าคู่แข่ง 3-4 เท่า closed-loop data advantage ที่ช่วย targeting และ network effect ความเสี่ยงหลักได้แก่ credit risk หากเศรษฐกิจชะลอตัว การแข่งขันจาก Visa/Mastercard/fintech ในกลุ่ม premium regulatory scrutiny ด้าน interchange fees และ merchant acceptance ที่ยังจำกัดเมื่อเทียบกับ Visa/Mastercard
AZO,AutoZone Inc.,Consumer Discretionary,Specialty Stores,"ราชาแห่งอะไหล่รถยนต์ — AutoZone เป็นผู้ค้าปลีกอะไหล่และอุปกรณ์รถยนต์รายใหญ่ที่สุดในสหรัฐ มีร้านกว่า 7,000 แห่งทั่ว US/Mexico/Brazil รายได้ปีงบล่าสุดกว่า $18B ธุรกิจแข็งแกร่งจาก aging vehicle fleet ที่ต้องการ maintenance มากขึ้น พร้อม commercial (B2B) segment ที่เติบโตเร็ว","AutoZone ก่อตั้งปี 1979 สำนักงานใหญ่ Memphis Tennessee เป็นผู้ค้าปลีกอะไหล่/อุปกรณ์ซ่อมบำรุงรถยนต์ (aftermarket auto parts) รายใหญ่ที่สุดในสหรัฐ มีร้านกว่า 7,000 แห่ง (US ~6,400/Mexico ~750/Brazil ~100) ธุรกิจแบ่ง 2 กลุ่ม: DIY (Do-It-Yourself retail) คิดเป็นราว 60% ของรายได้ ลูกค้าคือผู้บริโภคทั่วไป และ DIFM (Do-It-For-Me/Commercial) ราว 40% ลูกค้าคือช่างซ่อมรถ/อู่ซ่อม เป็น segment ที่โตเร็วที่สุด รายได้ปีงบล่าสุดกว่า $18B กลยุทธ์สำคัญคือการขยาย commercial business ผ่าน hub/mega-hub network ที่สต็อกสินค้ากว้างขวางขึ้น delivery ที่เร็วขึ้น และ technology investments พร้อมขยายสาขาใน Mexico/Brazil จุดแข็งคือ aging US vehicle fleet (เฉลี่ย 12.6 ปี) ที่สร้าง secular demand store network ที่ครอบคลุมที่สุด WOW! customer service culture และ capital allocation ที่ยอดเยี่ยม (aggressive share buybacks) ความเสี่ยงหลักได้แก่ EV adoption ในระยะยาวที่จะลด aftermarket parts demand การแข่งขันจาก O'Reilly/Advance/Amazon tariff ที่อาจเพิ่มต้นทุนสินค้า และ labor market ที่ตึงตัว"
